{
  "families": [
    {
      "authority_section_present": true,
      "boundary_statement_present": true,
      "bundle_review_check_count": 3,
      "eval_ready_skill_count": 3,
      "family": "abyss",
      "listed_matches_actual": true,
      "listed_skill_names": [
        "abyss-safe-infra-change",
        "abyss-sanitized-share",
        "abyss-self-diagnostic-spine"
      ],
      "project_overlay_path": "mechanics/boundary-bridge/overlays/abyss/PROJECT_OVERLAY.md",
      "project_skill_count": 3,
      "project_skill_names": [
        "abyss-safe-infra-change",
        "abyss-sanitized-share",
        "abyss-self-diagnostic-spine"
      ],
      "readiness_state": "reviewable",
      "repo_relative_statement_present": true,
      "review_mentions_all_skills": true,
      "review_path": "mechanics/boundary-bridge/overlays/abyss/REVIEW.md"
    },
    {
      "authority_section_present": true,
      "boundary_statement_present": true,
      "bundle_review_check_count": 2,
      "eval_ready_skill_count": 2,
      "family": "atm10",
      "listed_matches_actual": true,
      "listed_skill_names": [
        "atm10-change-protocol",
        "atm10-source-of-truth-check"
      ],
      "project_overlay_path": "mechanics/boundary-bridge/overlays/atm10/PROJECT_OVERLAY.md",
      "project_skill_count": 2,
      "project_skill_names": [
        "atm10-change-protocol",
        "atm10-source-of-truth-check"
      ],
      "readiness_state": "reviewable",
      "repo_relative_statement_present": true,
      "review_mentions_all_skills": true,
      "review_path": "mechanics/boundary-bridge/overlays/atm10/REVIEW.md"
    },
    {
      "authority_section_present": true,
      "boundary_statement_present": true,
      "bundle_review_check_count": 1,
      "eval_ready_skill_count": 1,
      "family": "os",
      "listed_matches_actual": true,
      "listed_skill_names": [
        "os-abyss-artifact-trust-loop"
      ],
      "project_overlay_path": "mechanics/boundary-bridge/overlays/os/PROJECT_OVERLAY.md",
      "project_skill_count": 1,
      "project_skill_names": [
        "os-abyss-artifact-trust-loop"
      ],
      "readiness_state": "reviewable",
      "repo_relative_statement_present": true,
      "review_mentions_all_skills": true,
      "review_path": "mechanics/boundary-bridge/overlays/os/REVIEW.md"
    },
    {
      "authority_section_present": true,
      "boundary_statement_present": true,
      "bundle_review_check_count": 15,
      "eval_ready_skill_count": 15,
      "family": "titan",
      "listed_matches_actual": true,
      "listed_skill_names": [
        "titan-approval-ledger",
        "titan-approval-loom",
        "titan-appserver-bridge",
        "titan-appserver-plan",
        "titan-closeout",
        "titan-console",
        "titan-event-replay",
        "titan-memory-loom",
        "titan-memory-prune",
        "titan-mutation-gate",
        "titan-recall",
        "titan-receipt",
        "titan-runtime-gate",
        "titan-summon",
        "titan-thread-turn-binding"
      ],
      "project_overlay_path": "mechanics/boundary-bridge/overlays/titan/PROJECT_OVERLAY.md",
      "project_skill_count": 15,
      "project_skill_names": [
        "titan-approval-ledger",
        "titan-approval-loom",
        "titan-appserver-bridge",
        "titan-appserver-plan",
        "titan-closeout",
        "titan-console",
        "titan-event-replay",
        "titan-memory-loom",
        "titan-memory-prune",
        "titan-mutation-gate",
        "titan-recall",
        "titan-receipt",
        "titan-runtime-gate",
        "titan-summon",
        "titan-thread-turn-binding"
      ],
      "readiness_state": "reviewable",
      "repo_relative_statement_present": true,
      "review_mentions_all_skills": true,
      "review_path": "mechanics/boundary-bridge/overlays/titan/REVIEW.md"
    }
  ],
  "overlay_readiness_version": 1,
  "skills": [
    {
      "eval_blockers": [],
      "eval_ready": true,
      "family": "abyss",
      "has_adaptation_points": true,
      "has_policy_file": true,
      "name": "abyss-safe-infra-change",
      "review_check_path": "skills/project/abyss/abyss-safe-infra-change/checks/review.md",
      "runtime_example_count": 1,
      "skill_path": "skills/project/abyss/abyss-safe-infra-change/SKILL.md",
      "status": "evaluated"
    },
    {
      "eval_blockers": [],
      "eval_ready": true,
      "family": "abyss",
      "has_adaptation_points": true,
      "has_policy_file": true,
      "name": "abyss-sanitized-share",
      "review_check_path": "skills/project/abyss/abyss-sanitized-share/checks/review.md",
      "runtime_example_count": 1,
      "skill_path": "skills/project/abyss/abyss-sanitized-share/SKILL.md",
      "status": "evaluated"
    },
    {
      "eval_blockers": [],
      "eval_ready": true,
      "family": "abyss",
      "has_adaptation_points": true,
      "has_policy_file": true,
      "name": "abyss-self-diagnostic-spine",
      "review_check_path": "skills/project/abyss/abyss-self-diagnostic-spine/checks/review.md",
      "runtime_example_count": 1,
      "skill_path": "skills/project/abyss/abyss-self-diagnostic-spine/SKILL.md",
      "status": "scaffold"
    },
    {
      "eval_blockers": [],
      "eval_ready": true,
      "family": "atm10",
      "has_adaptation_points": true,
      "has_policy_file": true,
      "name": "atm10-change-protocol",
      "review_check_path": "skills/project/atm10/atm10-change-protocol/checks/review.md",
      "runtime_example_count": 1,
      "skill_path": "skills/project/atm10/atm10-change-protocol/SKILL.md",
      "status": "evaluated"
    },
    {
      "eval_blockers": [],
      "eval_ready": true,
      "family": "atm10",
      "has_adaptation_points": true,
      "has_policy_file": true,
      "name": "atm10-source-of-truth-check",
      "review_check_path": "skills/project/atm10/atm10-source-of-truth-check/checks/review.md",
      "runtime_example_count": 1,
      "skill_path": "skills/project/atm10/atm10-source-of-truth-check/SKILL.md",
      "status": "evaluated"
    },
    {
      "eval_blockers": [],
      "eval_ready": true,
      "family": "os",
      "has_adaptation_points": true,
      "has_policy_file": true,
      "name": "os-abyss-artifact-trust-loop",
      "review_check_path": "skills/project/abyss/os-abyss-artifact-trust-loop/checks/review.md",
      "runtime_example_count": 1,
      "skill_path": "skills/project/abyss/os-abyss-artifact-trust-loop/SKILL.md",
      "status": "scaffold"
    },
    {
      "eval_blockers": [],
      "eval_ready": true,
      "family": "titan",
      "has_adaptation_points": true,
      "has_policy_file": true,
      "name": "titan-approval-ledger",
      "review_check_path": "skills/project/titan/titan-approval-ledger/checks/review.md",
      "runtime_example_count": 1,
      "skill_path": "skills/project/titan/titan-approval-ledger/SKILL.md",
      "status": "scaffold"
    },
    {
      "eval_blockers": [],
      "eval_ready": true,
      "family": "titan",
      "has_adaptation_points": true,
      "has_policy_file": true,
      "name": "titan-approval-loom",
      "review_check_path": "skills/project/titan/titan-approval-loom/checks/review.md",
      "runtime_example_count": 1,
      "skill_path": "skills/project/titan/titan-approval-loom/SKILL.md",
      "status": "scaffold"
    },
    {
      "eval_blockers": [],
      "eval_ready": true,
      "family": "titan",
      "has_adaptation_points": true,
      "has_policy_file": true,
      "name": "titan-appserver-bridge",
      "review_check_path": "skills/project/titan/titan-appserver-bridge/checks/review.md",
      "runtime_example_count": 1,
      "skill_path": "skills/project/titan/titan-appserver-bridge/SKILL.md",
      "status": "scaffold"
    },
    {
      "eval_blockers": [],
      "eval_ready": true,
      "family": "titan",
      "has_adaptation_points": true,
      "has_policy_file": true,
      "name": "titan-appserver-plan",
      "review_check_path": "skills/project/titan/titan-appserver-plan/checks/review.md",
      "runtime_example_count": 1,
      "skill_path": "skills/project/titan/titan-appserver-plan/SKILL.md",
      "status": "scaffold"
    },
    {
      "eval_blockers": [],
      "eval_ready": true,
      "family": "titan",
      "has_adaptation_points": true,
      "has_policy_file": true,
      "name": "titan-closeout",
      "review_check_path": "skills/project/titan/titan-closeout/checks/review.md",
      "runtime_example_count": 1,
      "skill_path": "skills/project/titan/titan-closeout/SKILL.md",
      "status": "scaffold"
    },
    {
      "eval_blockers": [],
      "eval_ready": true,
      "family": "titan",
      "has_adaptation_points": true,
      "has_policy_file": true,
      "name": "titan-console",
      "review_check_path": "skills/project/titan/titan-console/checks/review.md",
      "runtime_example_count": 1,
      "skill_path": "skills/project/titan/titan-console/SKILL.md",
      "status": "scaffold"
    },
    {
      "eval_blockers": [],
      "eval_ready": true,
      "family": "titan",
      "has_adaptation_points": true,
      "has_policy_file": true,
      "name": "titan-event-replay",
      "review_check_path": "skills/project/titan/titan-event-replay/checks/review.md",
      "runtime_example_count": 1,
      "skill_path": "skills/project/titan/titan-event-replay/SKILL.md",
      "status": "scaffold"
    },
    {
      "eval_blockers": [],
      "eval_ready": true,
      "family": "titan",
      "has_adaptation_points": true,
      "has_policy_file": true,
      "name": "titan-memory-loom",
      "review_check_path": "skills/project/titan/titan-memory-loom/checks/review.md",
      "runtime_example_count": 1,
      "skill_path": "skills/project/titan/titan-memory-loom/SKILL.md",
      "status": "scaffold"
    },
    {
      "eval_blockers": [],
      "eval_ready": true,
      "family": "titan",
      "has_adaptation_points": true,